{
  "manifest_version": "1.0.0",
  "vault_id": "zephyr-local-production-v1",
  "vault_type": "LOCAL_PRODUCTION_ARCHIVE",
  "provider": "HIGGSFIELD_LOCAL_ARCHIVE",
  "ingestion_method": "VERIFIED_LOCAL_ASSET",
  "project_id": "UNKNOWN",
  "source_root": "/mnt/c/Users/marqu/Dropbox/NEURO/Higgsfield/ZEPHYR_Characters_assets/ZEPHYR_Characters_assets",
  "generation_fallback": "PROHIBITED",
  "review_eligibility": "REVIEW_SEARCH_ONLY",
  "assets": [
    {
      "asset_id": "zephyr-local-sha256-bbead4d702b39068b996b74240a0eccf1c7660a83afa7580bc47e0be1674199a",
      "provider": "HIGGSFIELD_LOCAL_ARCHIVE",
      "provider_asset_id": "UNKNOWN",
      "project_id": "UNKNOWN",
      "soul_id": "UNKNOWN",
      "source_reference": {
        "kind": "LOCAL_AUTHORIZED_PATH",
        "value": "/mnt/c/Users/marqu/Dropbox/NEURO/Higgsfield/ZEPHYR_Characters_assets/ZEPHYR_Characters_assets/Alex (Battle Mode) [KIA].png",
        "contains_secrets": false
      },
      "source_evidence": "VERIFIED_LOCAL_FILE",
      "local_path": "/mnt/c/Users/marqu/Dropbox/NEURO/Higgsfield/ZEPHYR_Characters_assets/ZEPHYR_Characters_assets/Alex (Battle Mode) [KIA].png",
      "filename": "Alex (Battle Mode) [KIA].png",
      "extension": "png",
      "media_type": "IMAGE",
      "byte_size": 9531854,
      "sha256": "bbead4d702b39068b996b74240a0eccf1c7660a83afa7580bc47e0be1674199a",
      "dimensions": {
        "width": 4256,
        "height": 2375
      },
      "duration": null,
      "production_role": "CHARACTER_STATE",
      "character_family": "Alex",
      "variant_labels": [
        "Battle Mode",
        "KIA"
      ],
      "reference_tag": "@char_ZEPHYR_Alex_Battle_Mode_KIA",
      "reference_tag_status": "PROVISIONAL_LOCAL",
      "metadata_basis": "FILENAME_DERIVED",
      "local_character_family": "Alex",
      "provisional_reference_tag": "@char_ZEPHYR_Alex_Battle_Mode_KIA",
      "local_location_label": null,
      "local_prop_label": null,
      "local_mech_label": null,
      "local_creature_label": null,
      "review_eligibility": "REVIEW_SEARCH_ONLY",
      "rights_status": "REQUIRES_REVIEW",
      "canon_status": "REQUIRES_REVIEW",
      "identity_status": "REQUIRES_REVIEW",
      "continuity_status": "REQUIRES_REVIEW",
      "generation_fallback": "PROHIBITED"
    },
    {
      "asset_id": "zephyr-local-sha256-d4a2fcf9a4919ced38ea18b57651879d6ac525453ccc38c9b0c60829d5fa8bf2",
      "provider": "HIGGSFIELD_LOCAL_ARCHIVE",
      "provider_asset_id": "UNKNOWN",
      "project_id": "UNKNOWN",
      "soul_id": "UNKNOWN",
      "source_reference": {
        "kind": "LOCAL_AUTHORIZED_PATH",
        "value": "/mnt/c/Users/marqu/Dropbox/NEURO/Higgsfield/ZEPHYR_Characters_assets/ZEPHYR_Characters_assets/Backrooms.png",
        "contains_secrets": false
      },
      "source_evidence": "VERIFIED_LOCAL_FILE",
      "local_path": "/mnt/c/Users/marqu/Dropbox/NEURO/Higgsfield/ZEPHYR_Characters_assets/ZEPHYR_Characters_assets/Backrooms.png",
      "filename": "Backrooms.png",
      "extension": "png",
      "media_type": "IMAGE",
      "byte_size": 2068440,
      "sha256": "d4a2fcf9a4919ced38ea18b57651879d6ac525453ccc38c9b0c60829d5fa8bf2",
      "dimensions": {
        "width": 2048,
        "height": 1152
      },
      "duration": null,
      "production_role": "LOCATION",
      "character_family": null,
      "variant_labels": [],
      "reference_tag": "@loc_ZEPHYR_Backrooms",
      "reference_tag_status": "PROVISIONAL_LOCAL",
      "metadata_basis": "FILENAME_DERIVED",
      "local_character_family": null,
      "provisional_reference_tag": "@loc_ZEPHYR_Backrooms",
      "local_location_label": "Backrooms",
      "local_prop_label": null,
      "local_mech_label": null,
      "local_creature_label": null,
      "review_eligibility": "REVIEW_SEARCH_ONLY",
      "rights_status": "REQUIRES_REVIEW",
      "canon_status": "REQUIRES_REVIEW",
      "identity_status": "REQUIRES_REVIEW",
      "continuity_status": "REQUIRES_REVIEW",
      "generation_fallback": "PROHIBITED"
    },
    {
      "asset_id": "zephyr-local-sha256-1f275bf3d8b87456f7bf0daa8c5d5357f0d6cabcde885bece2f80334368ede44",
      "provider": "HIGGSFIELD_LOCAL_ARCHIVE",
      "provider_asset_id": "UNKNOWN",
      "project_id": "UNKNOWN",
      "soul_id": "UNKNOWN",
      "source_reference": {
        "kind": "LOCAL_AUTHORIZED_PATH",
        "value": "/mnt/c/Users/marqu/Dropbox/NEURO/Higgsfield/ZEPHYR_Characters_assets/ZEPHYR_Characters_assets/Chill room.png",
        "contains_secrets": false
      },
      "source_evidence": "VERIFIED_LOCAL_FILE",
      "local_path": "/mnt/c/Users/marqu/Dropbox/NEURO/Higgsfield/ZEPHYR_Characters_assets/ZEPHYR_Characters_assets/Chill room.png",
      "filename": "Chill room.png",
      "extension": "png",
      "media_type": "IMAGE",
      "byte_size": 2059642,
      "sha256": "1f275bf3d8b87456f7bf0daa8c5d5357f0d6cabcde885bece2f80334368ede44",
      "dimensions": {
        "width": 2048,
        "height": 1152
      },
      "duration": null,
      "production_role": "LOCATION",
      "character_family": null,
      "variant_labels": [],
      "reference_tag": "@loc_ZEPHYR_Chill_room",
      "reference_tag_status": "PROVISIONAL_LOCAL",
      "metadata_basis": "FILENAME_DERIVED",
      "local_character_family": null,
      "provisional_reference_tag": "@loc_ZEPHYR_Chill_room",
      "local_location_label": "Chill room",
      "local_prop_label": null,
      "local_mech_label": null,
      "local_creature_label": null,
      "review_eligibility": "REVIEW_SEARCH_ONLY",
      "rights_status": "REQUIRES_REVIEW",
      "canon_status": "REQUIRES_REVIEW",
      "identity_status": "REQUIRES_REVIEW",
      "continuity_status": "REQUIRES_REVIEW",
      "generation_fallback": "PROHIBITED"
    },
    {
      "asset_id": "zephyr-local-sha256-9fcfd30b47712c9bbbd0c4b68bc0f2488e3a53c5438873368cb5f61e4c111b8c",
      "provider": "HIGGSFIELD_LOCAL_ARCHIVE",
      "provider_asset_id": "UNKNOWN",
      "project_id": "UNKNOWN",
      "soul_id": "UNKNOWN",
      "source_reference": {
        "kind": "LOCAL_AUTHORIZED_PATH",
        "value": "/mnt/c/Users/marqu/Dropbox/NEURO/Higgsfield/ZEPHYR_Characters_assets/ZEPHYR_Characters_assets/City 1.jpg",
        "contains_secrets": false
      },
      "source_evidence": "VERIFIED_LOCAL_FILE",
      "local_path": "/mnt/c/Users/marqu/Dropbox/NEURO/Higgsfield/ZEPHYR_Characters_assets/ZEPHYR_Characters_assets/City 1.jpg",
      "filename": "City 1.jpg",
      "extension": "jpg",
      "media_type": "IMAGE",
      "byte_size": 904670,
      "sha256": "9fcfd30b47712c9bbbd0c4b68bc0f2488e3a53c5438873368cb5f61e4c111b8c",
      "dimensions": {
        "width": 2048,
        "height": 1152
      },
      "duration": null,
      "production_role": "LOCATION",
      "character_family": null,
      "variant_labels": [],
      "reference_tag": "@loc_ZEPHYR_City_1",
      "reference_tag_status": "PROVISIONAL_LOCAL",
      "metadata_basis": "FILENAME_DERIVED",
      "local_character_family": null,
      "provisional_reference_tag": "@loc_ZEPHYR_City_1",
      "local_location_label": "City 1",
      "local_prop_label": null,
      "local_mech_label": null,
      "local_creature_label": null,
      "review_eligibility": "REVIEW_SEARCH_ONLY",
      "rights_status": "REQUIRES_REVIEW",
      "canon_status": "REQUIRES_REVIEW",
      "identity_status": "REQUIRES_REVIEW",
      "continuity_status": "REQUIRES_REVIEW",
      "generation_fallback": "PROHIBITED"
    },
    {
      "asset_id": "zephyr-local-sha256-4e9abb5594197131d7f58921a62c1d2fa5bf2895b14fde84282c0713a0f749e2",
      "provider": "HIGGSFIELD_LOCAL_ARCHIVE",
      "provider_asset_id": "UNKNOWN",
      "project_id": "UNKNOWN",
      "soul_id": "UNKNOWN",
      "source_reference": {
        "kind": "LOCAL_AUTHORIZED_PATH",
        "value": "/mnt/c/Users/marqu/Dropbox/NEURO/Higgsfield/ZEPHYR_Characters_assets/ZEPHYR_Characters_assets/City 2.jpg",
        "contains_secrets": false
      },
      "source_evidence": "VERIFIED_LOCAL_FILE",
      "local_path": "/mnt/c/Users/marqu/Dropbox/NEURO/Higgsfield/ZEPHYR_Characters_assets/ZEPHYR_Characters_assets/City 2.jpg",
      "filename": "City 2.jpg",
      "extension": "jpg",
      "media_type": "IMAGE",
      "byte_size": 867519,
      "sha256": "4e9abb5594197131d7f58921a62c1d2fa5bf2895b14fde84282c0713a0f749e2",
      "dimensions": {
        "width": 2048,
        "height": 1152
      },
      "duration": null,
      "production_role": "LOCATION",
      "character_family": null,
      "variant_labels": [],
      "reference_tag": "@loc_ZEPHYR_City_2",
      "reference_tag_status": "PROVISIONAL_LOCAL",
      "metadata_basis": "FILENAME_DERIVED",
      "local_character_family": null,
      "provisional_reference_tag": "@loc_ZEPHYR_City_2",
      "local_location_label": "City 2",
      "local_prop_label": null,
      "local_mech_label": null,
      "local_creature_label": null,
      "review_eligibility": "REVIEW_SEARCH_ONLY",
      "rights_status": "REQUIRES_REVIEW",
      "canon_status": "REQUIRES_REVIEW",
      "identity_status": "REQUIRES_REVIEW",
      "continuity_status": "REQUIRES_REVIEW",
      "generation_fallback": "PROHIBITED"
    },
    {
      "asset_id": "zephyr-local-sha256-e109f7a1c7b405ea7a8f56c554d452fc6e09221e1ac8b05a548e6ebd7cd4529d",
      "provider": "HIGGSFIELD_LOCAL_ARCHIVE",
      "provider_asset_id": "UNKNOWN",
      "project_id": "UNKNOWN",
      "soul_id": "UNKNOWN",
      "source_reference": {
        "kind": "LOCAL_AUTHORIZED_PATH",
        "value": "/mnt/c/Users/marqu/Dropbox/NEURO/Higgsfield/ZEPHYR_Characters_assets/ZEPHYR_Characters_assets/City 3.jpg",
        "contains_secrets": false
      },
      "source_evidence": "VERIFIED_LOCAL_FILE",
      "local_path": "/mnt/c/Users/marqu/Dropbox/NEURO/Higgsfield/ZEPHYR_Characters_assets/ZEPHYR_Characters_assets/City 3.jpg",
      "filename": "City 3.jpg",
      "extension": "jpg",
      "media_type": "IMAGE",
      "byte_size": 758856,